{
  "fileVersion": "0.0.1",
  "standardsVersion": "0.0.1",
  "title": "Sample title",
  "description": "Sample description",
  "assertions": {
    "A.CPG.001": {
      "id": "A.CPG.001",
      "title": "Validate pagination - LinksPaginated ",
      "given": [
        "the page parameter is included in a GET request"
      ],
      "when": [
        "the page value is a number and page-size is [1,25,1000,null]"
      ],
      "then": {
        "and": [
          "the nominated <page number> is returned",
          " the response has a status of 200",
          " the \"first\" link has page=1",
          " the \"last\" link is greater than or equal to 1",
          " the \"self\" link has page=<page number>",
          " the \"prev\" link has page equal to 1 or <page number> - 1",
          " the \"prev\" link has page equal to \"last\" or <page number> + 1",
          " \"meta\"/\"totalPages\" is greater than or equal to <page number>",
          " \"meta\"/\"totalRecords\" is greater than or equal to <page number> * <page size>"
        ]
      },
      "references": [
        {
          "uri": "https://consumerdatastandardsaustralia.github.io/standards/#pagination"
        }
      ],
      "negative": false
    },
    "A.CPG.002": {
      "id": "A.CPG.002",
      "title": "Validate pagination - Invalid page size value",
      "given": [
        "the <page-size> parameter is specified in a GET request"
      ],
      "when": [
        "the value for <page-size> is outside the range [1..1000]",
        "OR the <page-size> is a not a positive integer"
      ],
      "then": {
        "and": [
          "the response has a status of 400",
          " the response body has ErrorListReponse object",
          " error code is \"Field/InvalidPageSize\""
        ]
      },
      "references": [
        {
          "uri": "https://consumerdatastandardsaustralia.github.io/standards/#error-codes"
        }
      ],
      "negative": false
    },
    "A.CPG.003": {
      "id": "A.CPG.003",
      "title": "Validate pagination - Non-numeric <page>",
      "given": [
        "the <page> parameter is included in a GET request"
      ],
      "when": [
        "the <page> is a not a positive integer"
      ],
      "then": {
        "and": [
          "the response has a status of 400",
          " the response body has ErrorListReponse object",
          " error code is \"Field/Invalid\""
        ]
      },
      "references": [
        {
          "uri": "https://consumerdatastandardsaustralia.github.io/standards/#error-codes"
        }
      ],
      "negative": false
    },
    "A.CPG.004": {
      "id": "A.CPG.004",
      "title": "Validate pagination - Max record limit exceeded",
      "given": [
        "the <page> parameter is included in a GET request"
      ],
      "when": [
        "the <page> value is greater than the number of pages available "
      ],
      "then": {
        "and": [
          "the response has a status of 422",
          " the response body has ErrorListReponse object",
          " the error code is \"Field/InvalidPage\""
        ]
      },
      "references": [
        {
          "uri": "https://consumerdatastandardsaustralia.github.io/standards/#error-codes"
        }
      ],
      "negative": false
    },
    "A.CPG.005": {
      "id": "A.CPG.005",
      "title": "Validate pagination - Non-numeric <page-size>",
      "given": [
        "the <page-size> parameter is included in a GET request"
      ],
      "when": [
        "the page size parameter value is not a positive integer (number)"
      ],
      "then": {
        "and": [
          "the response has a status of 400",
          " the response body has ErrorListReponse object",
          " error code is \"Field/Invalid\""
        ]
      },
      "references": [
        {
          "uri": "https://consumerdatastandardsaustralia.github.io/standards/#error-codes"
        }
      ],
      "negative": false
    },
    "A.CVN.001": {
      "id": "A.CVN.001",
      "title": "Validate version - valid version number [x-v]",
      "given": [
        "the <x-v> header is included in a get request"
      ],
      "when": [
        "the value for the <x-v> is a positive integer"
      ],
      "then": {
        "and": [
          "the response has a status of 200",
          " <x-v> is in the repsonse header",
          " <x-v> is a positive integer"
        ]
      },
      "references": [
        {
          "uri": "https://consumerdatastandardsaustralia.github.io/standards/#http-headers"
        }
      ],
      "negative": false
    },
    "A.CVN.002": {
      "id": "A.CVN.002",
      "title": "Validate version - invalid version value [x-v]",
      "given": [
        "the version parameter is included in a GET request"
      ],
      "when": [
        "the version value is not a valid number is [-1,0,1001]"
      ],
      "then": {
        "and": [
          "the response has a status of 400",
          " the response body has ErrorListReponse object",
          " error code is \"Field/Invalid\""
        ]
      },
      "references": [
        {
          "uri": "https://consumerdatastandardsaustralia.github.io/standards/#http-headers"
        }
      ],
      "negative": false
    },
    "A.CVN.003": {
      "id": "A.CVN.003",
      "title": "Validate version - validate [x-v] format",
      "given": [
        "the version parameter is included in a GET request"
      ],
      "when": [
        "the verison value is not a valid number is an alpha (e.g. \"foo\")"
      ],
      "then": {
        "and": [
          "the response has a status of 400",
          " the response body has ErrorListReponse object",
          " error code is \"Field/Invalid\""
        ]
      },
      "references": [
        {
          "uri": "https://consumerdatastandardsaustralia.github.io/standards/#http-headers"
        }
      ],
      "negative": false
    },
    "A.CVN.004": {
      "id": "A.CVN.004",
      "title": "Validate version - supported version without <x-v-min>",
      "given": [
        "the <x-v>  is included in a  request header",
        "AND <x-v-min> is NOT included"
      ],
      "when": [
        "the request version <x-v> is not supported"
      ],
      "then": {
        "and": [
          "the response has a status of 406",
          " the response body has ErrorListReponse object",
          " error code is \"Header/UnsupportedVersion\""
        ]
      },
      "references": [
        {
          "uri": "https://consumerdatastandardsaustralia.github.io/standards/#http-headers"
        }
      ],
      "negative": false
    },
    "A.CVN.005": {
      "id": "A.CVN.005",
      "title": "Validate version - supported version with <x-v-min>",
      "given": [
        "the <x-v>  is included in a  request header",
        "AND <x-v-min> is included"
      ],
      "when": [
        "no version between <x-v> and <x-min-v> is supported"
      ],
      "then": {
        "and": [
          "the response has a status of 406",
          " the response body has ErrorListReponse object",
          " error code is \"Header/UnsupportedVersion\""
        ]
      },
      "references": [
        {
          "uri": "https://consumerdatastandardsaustralia.github.io/standards/#http-headers"
        }
      ],
      "negative": false
    },
    "A.CVM.001": {
      "id": "A.CVM.001",
      "title": "Validate version - <x-v-min> is provided",
      "given": [
        "the <x-v-min> header is included in a get request"
      ],
      "when": [
        "the value for the <x-v-min>  is a positive integer"
      ],
      "then": {
        "and": [
          "<x-v> is in the repsonse header",
          "  <x-v> = [<x-v-min>, <x-v>]",
          " <x-v> is a positive integer"
        ]
      },
      "references": [
        {
          "uri": "https://consumerdatastandardsaustralia.github.io/standards/#http-headers"
        }
      ],
      "negative": false
    },
    "A.CVM.002": {
      "id": "A.CVM.002",
      "title": "Validate minimum version - validate <x-v-min> format",
      "given": [
        "the <x-v-min> header is included in a get request"
      ],
      "when": [
        "the <x-min-v> is a not a positive integer"
      ],
      "then": {
        "and": [
          "the response has a status of 400",
          " the response body has ErrorListReponse object",
          " error code is \"Field/Invalid\""
        ]
      },
      "references": [
        {
          "uri": "https://consumerdatastandardsaustralia.github.io/standards/#http-headers"
        }
      ],
      "negative": false
    },
    "A.CFI.001": {
      "id": "A.CFI.001",
      "title": "Validate FAPI Interation ID - included in request",
      "given": [
        "the <x-fapi-interaction-id> is included in the header of the request"
      ],
      "when": [
        "the <x-fapi-interaction-id> is in a valid format "
      ],
      "then": {
        "and": [
          "the response has a status of 200",
          " the Data Holder has returned the <x-fapi-interaction-id> from the request in the response header"
        ]
      },
      "references": [
        {
          "uri": "https://consumerdatastandardsaustralia.github.io/standards/#http-headers"
        }
      ],
      "negative": false
    },
    "A.CFI.003": {
      "id": "A.CFI.003",
      "title": "Validate FAPI Interation ID - invalid format",
      "given": [
        "the <x-fapi-interaction-id> is included in the GET request"
      ],
      "when": [
        "the <x-fapi-interaction-id> is not in a valid format "
      ],
      "then": {
        "and": [
          "the response has a status of 400",
          " the response body has ErrorListReponse object",
          " error code is \"Header/invalid\""
        ]
      },
      "references": [
        {
          "uri": "https://consumerdatastandardsaustralia.github.io/standards/#http-headers"
        }
      ],
      "negative": false
    },
    "A.CFA.001": {